{
  "schemaVersion": "daily-game-puzzle.v1",
  "gameId": "city-grid",
  "puzzleId": "city-grid-v1-0631",
  "date": "2026-01-01",
  "seed": "city-grid-v1-0631",
  "display": {
    "title": "City Grid",
    "initialPrompt": "Identify the city from the unlabeled street grid."
  },
  "extension": {
    "answer": {
      "entityId": "city:jp:tokyo:tokyo",
      "canonicalName": "Tokyo",
      "aliases": [
        "Tokyo Japan",
        "Tokyo Metropolis",
        "Tokyo JP",
        "Tokio"
      ],
      "countryCode": "JP",
      "country": "Japan",
      "admin1": "Tokyo",
      "lat": 35.6762,
      "lon": 139.6503,
      "population": 13960000
    },
    "candidateSetId": "real-osm-city-sample-v1",
    "source": {
      "kind": "osm-derived",
      "sourceManifest": "content/source/osm-source-manifest.json",
      "sourceExtractId": "overpass-real-osm-city-sample-v1",
      "bbox": {
        "left": 139.7,
        "bottom": 35.65,
        "right": 139.78,
        "top": 35.71
      },
      "geometryVersion": "city-grid-geometry.v1"
    },
    "assetStages": [
      {
        "stage": 0,
        "assetPath": "content/assets/v1/city-grid/tokyo/stage-0.svg",
        "reveals": [
          "roads-tight"
        ]
      },
      {
        "stage": 1,
        "assetPath": "content/assets/v1/city-grid/tokyo/stage-1.svg",
        "reveals": [
          "roads-wide"
        ]
      },
      {
        "stage": 2,
        "assetPath": "content/assets/v1/city-grid/tokyo/stage-2.svg",
        "reveals": [
          "water",
          "coastline"
        ]
      },
      {
        "stage": 3,
        "assetPath": "content/assets/v1/city-grid/tokyo/stage-3.svg",
        "reveals": [
          "parks",
          "rail"
        ]
      },
      {
        "stage": 4,
        "assetPath": "content/assets/v1/city-grid/tokyo/stage-4.svg",
        "reveals": [
          "anonymous-landmarks"
        ]
      },
      {
        "stage": 5,
        "assetPath": "content/assets/v1/city-grid/tokyo/stage-5.svg",
        "reveals": [
          "full-map-geometry"
        ]
      }
    ],
    "geometryMetrics": {
      "roadLineCount": 780,
      "roadTotalLengthMeters": 405964,
      "intersectionCount": 500,
      "waterGeometryCount": 120,
      "parkGeometryCount": 140,
      "railLineCount": 120
    },
    "clues": {
      "continent": "Asia",
      "country": "Japan",
      "populationBand": "1m+",
      "coastal": true,
      "hasMajorRapidTransit": true
    }
  }
}
