{
  "schemaVersion": "daily-game-puzzle.v1",
  "gameId": "flag-fade",
  "puzzleId": "flag-fade-v1-0165",
  "date": "2026-01-01",
  "seed": "flag-fade-v1-0165",
  "display": {
    "title": "Flag Fade",
    "initialPrompt": "Guess the country from the progressively clearer flag."
  },
  "extension": {
    "answer": {
      "entityId": "country:china",
      "canonicalName": "China",
      "aliases": [
        "People's Republic of China",
        "PRC",
        "CN",
        "CHN",
        "Chinese flag"
      ],
      "iso2": "CN",
      "iso3": "CHN",
      "continent": "Asia",
      "clues": {
        "dominantColors": [
          "red",
          "yellow"
        ],
        "hasEmblem": true,
        "stripeOrientation": "none",
        "aspectRatio": "2:3",
        "continent": "Asia",
        "designFeatures": [
          "stars",
          "canton"
        ],
        "similarityGroups": [
          "red-yellow",
          "stars"
        ]
      }
    },
    "candidateSetId": "countries-v1",
    "assetStages": [
      {
        "stage": 0,
        "assetPath": "content/assets/v1/flag-fade/cn/stage-0.svg",
        "reveals": [
          "palette"
        ]
      },
      {
        "stage": 1,
        "assetPath": "content/assets/v1/flag-fade/cn/stage-1.svg",
        "reveals": [
          "pixelated"
        ]
      },
      {
        "stage": 2,
        "assetPath": "content/assets/v1/flag-fade/cn/stage-2.svg",
        "reveals": [
          "blurred"
        ]
      },
      {
        "stage": 3,
        "assetPath": "content/assets/v1/flag-fade/cn/stage-3.svg",
        "reveals": [
          "major-shapes",
          "emblem"
        ]
      },
      {
        "stage": 4,
        "assetPath": "content/assets/v1/flag-fade/cn/stage-4.svg",
        "reveals": [
          "near-full"
        ]
      },
      {
        "stage": 5,
        "assetPath": "content/assets/v1/flag-fade/cn/stage-5.svg",
        "reveals": [
          "full-flag"
        ]
      }
    ],
    "clues": {
      "dominantColors": [
        "red",
        "yellow"
      ],
      "hasEmblem": true,
      "stripeOrientation": "none",
      "aspectRatio": "2:3",
      "continent": "Asia",
      "designFeatures": [
        "stars",
        "canton"
      ],
      "similarityGroups": [
        "red-yellow",
        "stars"
      ]
    },
    "similarFlags": [
      {
        "entityId": "country:spain",
        "similarTo": [
          "country:china"
        ],
        "reason": "shared flag design family"
      },
      {
        "entityId": "country:australia",
        "similarTo": [
          "country:china"
        ],
        "reason": "shared flag design family"
      },
      {
        "entityId": "country:turkey",
        "similarTo": [
          "country:china"
        ],
        "reason": "shared flag design family"
      }
    ]
  }
}
