{
  "schemaVersion": "daily-game-puzzle.v1",
  "gameId": "city-grid",
  "puzzleId": "city-grid-v1-0161",
  "date": "2026-01-01",
  "seed": "city-grid-v1-0161",
  "display": {
    "title": "City Grid",
    "initialPrompt": "Identify the city from the unlabeled street grid."
  },
  "extension": {
    "answer": {
      "entityId": "city:geonames:1168197",
      "canonicalName": "Peshawar",
      "aliases": [
        "Peshawar",
        "Peshawar, PK",
        "Peshawar Pakistan",
        "Peshawar Khyber Pakhtunkhwa"
      ],
      "countryCode": "PK",
      "country": "Pakistan",
      "admin1": "Khyber Pakhtunkhwa",
      "lat": 34.008,
      "lon": 71.57849,
      "population": 4758762
    },
    "candidateSetId": "world-top-100-cities-geonames-v1",
    "source": {
      "kind": "osm-derived",
      "sourceManifest": "content/source/osm-source-manifest.json",
      "sourceExtractId": "overpass-real-osm-world-top-100-geonames-v1",
      "bbox": {
        "left": 71.535019,
        "bottom": 33.971964,
        "right": 71.621961,
        "top": 34.044036
      },
      "geometryVersion": "city-grid-geometry.v1"
    },
    "assetStages": [
      {
        "stage": 0,
        "assetPath": "content/assets/v1/city-grid/peshawar-pk-1168197/stage-0.svg",
        "reveals": [
          "roads-tight"
        ]
      },
      {
        "stage": 1,
        "assetPath": "content/assets/v1/city-grid/peshawar-pk-1168197/stage-1.svg",
        "reveals": [
          "roads-wide"
        ]
      },
      {
        "stage": 2,
        "assetPath": "content/assets/v1/city-grid/peshawar-pk-1168197/stage-2.svg",
        "reveals": [
          "water",
          "coastline"
        ]
      },
      {
        "stage": 3,
        "assetPath": "content/assets/v1/city-grid/peshawar-pk-1168197/stage-3.svg",
        "reveals": [
          "parks",
          "rail"
        ]
      },
      {
        "stage": 4,
        "assetPath": "content/assets/v1/city-grid/peshawar-pk-1168197/stage-4.svg",
        "reveals": [
          "anonymous-landmarks"
        ]
      },
      {
        "stage": 5,
        "assetPath": "content/assets/v1/city-grid/peshawar-pk-1168197/stage-5.svg",
        "reveals": [
          "full-map-geometry"
        ]
      }
    ],
    "geometryMetrics": {
      "roadLineCount": 380,
      "roadTotalLengthMeters": 366997,
      "intersectionCount": 234,
      "waterGeometryCount": 50,
      "parkGeometryCount": 80,
      "railLineCount": 58
    },
    "clues": {
      "continent": "Asia",
      "country": "Pakistan",
      "populationBand": "3m-5m",
      "coastal": false,
      "hasMajorRapidTransit": true
    }
  }
}
