{
  "schemaVersion": "daily-game-puzzle.v1",
  "gameId": "city-grid",
  "puzzleId": "city-grid-v1-0298",
  "date": "2026-01-01",
  "seed": "city-grid-v1-0298",
  "display": {
    "title": "City Grid",
    "initialPrompt": "Identify the city from the unlabeled street grid."
  },
  "extension": {
    "answer": {
      "entityId": "city:geonames:5856195",
      "canonicalName": "Honolulu",
      "aliases": [
        "Honolulu",
        "Honolulu, US",
        "Honolulu United States",
        "Honolulu Hawaii"
      ],
      "countryCode": "US",
      "country": "United States",
      "admin1": "Hawaii",
      "lat": 21.30694,
      "lon": -157.85833,
      "population": 350964
    },
    "candidateSetId": "world-famous-cities-geonames-v1",
    "source": {
      "kind": "osm-derived",
      "sourceManifest": "content/source/osm-source-manifest.json",
      "sourceExtractId": "overpass-real-osm-world-famous-geonames-v1",
      "bbox": {
        "left": -157.894592,
        "bottom": 21.273156,
        "right": -157.822068,
        "top": 21.340724
      },
      "geometryVersion": "city-grid-geometry.v1",
      "orientation": "north-up"
    },
    "assetStages": [
      {
        "stage": 0,
        "assetPath": "content/assets/v1/city-grid/honolulu-us-5856195/stage-0.svg",
        "reveals": [
          "roads-tight"
        ]
      },
      {
        "stage": 1,
        "assetPath": "content/assets/v1/city-grid/honolulu-us-5856195/stage-1.svg",
        "reveals": [
          "roads-wide",
          "arterials"
        ]
      },
      {
        "stage": 2,
        "assetPath": "content/assets/v1/city-grid/honolulu-us-5856195/stage-2.svg",
        "reveals": [
          "water",
          "coastline"
        ]
      },
      {
        "stage": 3,
        "assetPath": "content/assets/v1/city-grid/honolulu-us-5856195/stage-3.svg",
        "reveals": [
          "parks",
          "rail"
        ]
      },
      {
        "stage": 4,
        "assetPath": "content/assets/v1/city-grid/honolulu-us-5856195/stage-4.svg",
        "reveals": [
          "neighborhood-streets",
          "anonymous-landmarks"
        ]
      },
      {
        "stage": 5,
        "assetPath": "content/assets/v1/city-grid/honolulu-us-5856195/stage-5.svg",
        "reveals": [
          "full-street-network",
          "full-map-geometry"
        ]
      }
    ],
    "geometryMetrics": {
      "roadLineCount": 1160,
      "roadTotalLengthMeters": 283374,
      "intersectionCount": 611,
      "waterGeometryCount": 52,
      "parkGeometryCount": 140,
      "railLineCount": 6
    },
    "clues": {
      "continent": "North America",
      "country": "United States",
      "populationBand": "100k-1m",
      "coastal": false,
      "hasMajorRapidTransit": false
    }
  }
}
