{
  "schemaVersion": "daily-game-puzzle.v1",
  "gameId": "city-grid",
  "puzzleId": "city-grid-v1-0403",
  "date": "2026-01-01",
  "seed": "city-grid-v1-0403",
  "display": {
    "title": "City Grid",
    "initialPrompt": "Identify the city from the unlabeled street grid."
  },
  "extension": {
    "answer": {
      "entityId": "city:geonames:1850147",
      "canonicalName": "Tokyo",
      "aliases": [
        "Tokyo",
        "Tokyo, JP",
        "Tokyo Japan",
        "Tokyo Tokyo"
      ],
      "countryCode": "JP",
      "country": "Japan",
      "admin1": "Tokyo",
      "lat": 35.6895,
      "lon": 139.69171,
      "population": 9733276
    },
    "candidateSetId": "world-famous-cities-geonames-v1",
    "source": {
      "kind": "osm-derived",
      "sourceManifest": "content/source/osm-source-manifest.json",
      "sourceExtractId": "overpass-real-osm-world-famous-geonames-v1",
      "bbox": {
        "left": 139.641795,
        "bottom": 35.648959,
        "right": 139.741625,
        "top": 35.730041
      },
      "geometryVersion": "city-grid-geometry.v1"
    },
    "assetStages": [
      {
        "stage": 0,
        "assetPath": "content/assets/v1/city-grid/tokyo-jp-1850147/stage-0.svg",
        "reveals": [
          "roads-tight"
        ]
      },
      {
        "stage": 1,
        "assetPath": "content/assets/v1/city-grid/tokyo-jp-1850147/stage-1.svg",
        "reveals": [
          "roads-wide"
        ]
      },
      {
        "stage": 2,
        "assetPath": "content/assets/v1/city-grid/tokyo-jp-1850147/stage-2.svg",
        "reveals": [
          "water",
          "coastline"
        ]
      },
      {
        "stage": 3,
        "assetPath": "content/assets/v1/city-grid/tokyo-jp-1850147/stage-3.svg",
        "reveals": [
          "parks",
          "rail"
        ]
      },
      {
        "stage": 4,
        "assetPath": "content/assets/v1/city-grid/tokyo-jp-1850147/stage-4.svg",
        "reveals": [
          "anonymous-landmarks"
        ]
      },
      {
        "stage": 5,
        "assetPath": "content/assets/v1/city-grid/tokyo-jp-1850147/stage-5.svg",
        "reveals": [
          "full-map-geometry"
        ]
      }
    ],
    "geometryMetrics": {
      "roadLineCount": 380,
      "roadTotalLengthMeters": 301198,
      "intersectionCount": 205,
      "waterGeometryCount": 70,
      "parkGeometryCount": 80,
      "railLineCount": 70
    },
    "clues": {
      "continent": "Asia",
      "country": "Japan",
      "populationBand": "5m-10m",
      "coastal": false,
      "hasMajorRapidTransit": true
    }
  }
}
