{
  "schemaVersion": "daily-game-puzzle.v1",
  "gameId": "city-grid",
  "puzzleId": "city-grid-v1-0752",
  "date": "2026-01-01",
  "seed": "city-grid-v1-0752",
  "display": {
    "title": "City Grid",
    "initialPrompt": "Identify the city from the unlabeled street grid."
  },
  "extension": {
    "answer": {
      "entityId": "city:us:ma:boston",
      "canonicalName": "Boston",
      "aliases": [
        "Boston, MA",
        "Boston Massachusetts",
        "Beantown",
        "Boston MA"
      ],
      "countryCode": "US",
      "country": "United States",
      "admin1": "Massachusetts",
      "lat": 42.3601,
      "lon": -71.0589,
      "population": 675647
    },
    "candidateSetId": "real-osm-city-sample-v1",
    "source": {
      "kind": "osm-derived",
      "sourceManifest": "content/source/osm-source-manifest.json",
      "sourceExtractId": "overpass-real-osm-city-sample-v1",
      "bbox": {
        "left": -71.12,
        "bottom": 42.32,
        "right": -71.02,
        "top": 42.39
      },
      "geometryVersion": "city-grid-geometry.v1"
    },
    "assetStages": [
      {
        "stage": 0,
        "assetPath": "content/assets/v1/city-grid/boston/stage-0.svg",
        "reveals": [
          "roads-tight"
        ]
      },
      {
        "stage": 1,
        "assetPath": "content/assets/v1/city-grid/boston/stage-1.svg",
        "reveals": [
          "roads-wide"
        ]
      },
      {
        "stage": 2,
        "assetPath": "content/assets/v1/city-grid/boston/stage-2.svg",
        "reveals": [
          "water",
          "coastline"
        ]
      },
      {
        "stage": 3,
        "assetPath": "content/assets/v1/city-grid/boston/stage-3.svg",
        "reveals": [
          "parks",
          "rail"
        ]
      },
      {
        "stage": 4,
        "assetPath": "content/assets/v1/city-grid/boston/stage-4.svg",
        "reveals": [
          "anonymous-landmarks"
        ]
      },
      {
        "stage": 5,
        "assetPath": "content/assets/v1/city-grid/boston/stage-5.svg",
        "reveals": [
          "full-map-geometry"
        ]
      }
    ],
    "geometryMetrics": {
      "roadLineCount": 780,
      "roadTotalLengthMeters": 381425,
      "intersectionCount": 438,
      "waterGeometryCount": 120,
      "parkGeometryCount": 140,
      "railLineCount": 120
    },
    "clues": {
      "continent": "North America",
      "country": "United States",
      "populationBand": "500k-1m",
      "coastal": true,
      "hasMajorRapidTransit": true
    }
  }
}
