{
  "schemaVersion": "daily-game-puzzle.v1",
  "gameId": "city-grid",
  "puzzleId": "city-grid-v1-0751",
  "date": "2026-01-01",
  "seed": "city-grid-v1-0751",
  "display": {
    "title": "City Grid",
    "initialPrompt": "Identify the city from the unlabeled street grid."
  },
  "extension": {
    "answer": {
      "entityId": "city:geonames:498817",
      "canonicalName": "Saint Petersburg",
      "aliases": [
        "Saint Petersburg",
        "Saint Petersburg, RU",
        "Saint Petersburg Russia",
        "Saint Petersburg St.-Petersburg"
      ],
      "countryCode": "RU",
      "country": "Russia",
      "admin1": "St.-Petersburg",
      "lat": 59.93863,
      "lon": 30.31413,
      "population": 5351935
    },
    "candidateSetId": "world-top-100-cities-geonames-v1",
    "source": {
      "kind": "osm-derived",
      "sourceManifest": "content/source/osm-source-manifest.json",
      "sourceExtractId": "overpass-real-osm-world-top-100-geonames-v1",
      "bbox": {
        "left": 30.237695,
        "bottom": 59.900342,
        "right": 30.390565,
        "top": 59.976918
      },
      "geometryVersion": "city-grid-geometry.v1"
    },
    "assetStages": [
      {
        "stage": 0,
        "assetPath": "content/assets/v1/city-grid/saint-petersburg-ru-498817/stage-0.svg",
        "reveals": [
          "roads-tight"
        ]
      },
      {
        "stage": 1,
        "assetPath": "content/assets/v1/city-grid/saint-petersburg-ru-498817/stage-1.svg",
        "reveals": [
          "roads-wide"
        ]
      },
      {
        "stage": 2,
        "assetPath": "content/assets/v1/city-grid/saint-petersburg-ru-498817/stage-2.svg",
        "reveals": [
          "water",
          "coastline"
        ]
      },
      {
        "stage": 3,
        "assetPath": "content/assets/v1/city-grid/saint-petersburg-ru-498817/stage-3.svg",
        "reveals": [
          "parks",
          "rail"
        ]
      },
      {
        "stage": 4,
        "assetPath": "content/assets/v1/city-grid/saint-petersburg-ru-498817/stage-4.svg",
        "reveals": [
          "anonymous-landmarks"
        ]
      },
      {
        "stage": 5,
        "assetPath": "content/assets/v1/city-grid/saint-petersburg-ru-498817/stage-5.svg",
        "reveals": [
          "full-map-geometry"
        ]
      }
    ],
    "geometryMetrics": {
      "roadLineCount": 380,
      "roadTotalLengthMeters": 231895,
      "intersectionCount": 217,
      "waterGeometryCount": 70,
      "parkGeometryCount": 80,
      "railLineCount": 70
    },
    "clues": {
      "continent": "Europe",
      "country": "Russia",
      "populationBand": "5m-10m",
      "coastal": false,
      "hasMajorRapidTransit": true
    }
  }
}
