{
  "schemaVersion": "daily-game-puzzle.v1",
  "gameId": "city-grid",
  "puzzleId": "city-grid-v1-0309",
  "date": "2026-01-01",
  "seed": "city-grid-v1-0309",
  "display": {
    "title": "City Grid",
    "initialPrompt": "Identify the city from the unlabeled street grid."
  },
  "extension": {
    "answer": {
      "entityId": "city:gb:eng:london",
      "canonicalName": "London",
      "aliases": [
        "London, UK",
        "London England",
        "City of London",
        "London GB"
      ],
      "countryCode": "GB",
      "country": "United Kingdom",
      "admin1": "England",
      "lat": 51.5072,
      "lon": -0.1276,
      "population": 8799800
    },
    "candidateSetId": "real-osm-city-sample-v1",
    "source": {
      "kind": "osm-derived",
      "sourceManifest": "content/source/osm-source-manifest.json",
      "sourceExtractId": "overpass-real-osm-city-sample-v1",
      "bbox": {
        "left": -0.15,
        "bottom": 51.49,
        "right": -0.07,
        "top": 51.53
      },
      "geometryVersion": "city-grid-geometry.v1"
    },
    "assetStages": [
      {
        "stage": 0,
        "assetPath": "content/assets/v1/city-grid/london/stage-0.svg",
        "reveals": [
          "roads-tight"
        ]
      },
      {
        "stage": 1,
        "assetPath": "content/assets/v1/city-grid/london/stage-1.svg",
        "reveals": [
          "roads-wide"
        ]
      },
      {
        "stage": 2,
        "assetPath": "content/assets/v1/city-grid/london/stage-2.svg",
        "reveals": [
          "water",
          "coastline"
        ]
      },
      {
        "stage": 3,
        "assetPath": "content/assets/v1/city-grid/london/stage-3.svg",
        "reveals": [
          "parks",
          "rail"
        ]
      },
      {
        "stage": 4,
        "assetPath": "content/assets/v1/city-grid/london/stage-4.svg",
        "reveals": [
          "anonymous-landmarks"
        ]
      },
      {
        "stage": 5,
        "assetPath": "content/assets/v1/city-grid/london/stage-5.svg",
        "reveals": [
          "full-map-geometry"
        ]
      }
    ],
    "geometryMetrics": {
      "roadLineCount": 780,
      "roadTotalLengthMeters": 150036,
      "intersectionCount": 352,
      "waterGeometryCount": 80,
      "parkGeometryCount": 140,
      "railLineCount": 120
    },
    "clues": {
      "continent": "Europe",
      "country": "United Kingdom",
      "populationBand": "1m+",
      "coastal": false,
      "hasMajorRapidTransit": true
    }
  }
}
