{
  "schemaVersion": "daily-game-puzzle.v1",
  "gameId": "city-grid",
  "puzzleId": "city-grid-v1-0783",
  "date": "2026-01-01",
  "seed": "city-grid-v1-0783",
  "display": {
    "title": "City Grid",
    "initialPrompt": "Identify the city from the unlabeled street grid."
  },
  "extension": {
    "answer": {
      "entityId": "city:geonames:1275004",
      "canonicalName": "Kolkata",
      "aliases": [
        "Kolkata",
        "Kolkata, IN",
        "Kolkata India",
        "Kolkata West Bengal"
      ],
      "countryCode": "IN",
      "country": "India",
      "admin1": "West Bengal",
      "lat": 22.56263,
      "lon": 88.36304,
      "population": 4631392
    },
    "candidateSetId": "world-famous-cities-geonames-v1",
    "source": {
      "kind": "osm-derived",
      "sourceManifest": "content/source/osm-source-manifest.json",
      "sourceExtractId": "overpass-real-osm-world-famous-geonames-v1",
      "bbox": {
        "left": 88.321578,
        "bottom": 22.524342,
        "right": 88.404502,
        "top": 22.600918
      },
      "geometryVersion": "city-grid-geometry.v1",
      "orientation": "north-up"
    },
    "assetStages": [
      {
        "stage": 0,
        "assetPath": "content/assets/v1/city-grid/kolkata-in-1275004/stage-0.svg",
        "reveals": [
          "roads-tight"
        ]
      },
      {
        "stage": 1,
        "assetPath": "content/assets/v1/city-grid/kolkata-in-1275004/stage-1.svg",
        "reveals": [
          "roads-wide",
          "arterials"
        ]
      },
      {
        "stage": 2,
        "assetPath": "content/assets/v1/city-grid/kolkata-in-1275004/stage-2.svg",
        "reveals": [
          "water",
          "coastline"
        ]
      },
      {
        "stage": 3,
        "assetPath": "content/assets/v1/city-grid/kolkata-in-1275004/stage-3.svg",
        "reveals": [
          "parks",
          "rail"
        ]
      },
      {
        "stage": 4,
        "assetPath": "content/assets/v1/city-grid/kolkata-in-1275004/stage-4.svg",
        "reveals": [
          "neighborhood-streets",
          "anonymous-landmarks"
        ]
      },
      {
        "stage": 5,
        "assetPath": "content/assets/v1/city-grid/kolkata-in-1275004/stage-5.svg",
        "reveals": [
          "full-street-network",
          "full-map-geometry"
        ]
      }
    ],
    "geometryMetrics": {
      "roadLineCount": 1160,
      "roadTotalLengthMeters": 458976,
      "intersectionCount": 662,
      "waterGeometryCount": 160,
      "parkGeometryCount": 140,
      "railLineCount": 100
    },
    "clues": {
      "continent": "Asia",
      "country": "India",
      "populationBand": "3m-5m",
      "coastal": false,
      "hasMajorRapidTransit": true
    }
  }
}
