{
  "schemaVersion": "daily-game-puzzle.v1",
  "gameId": "city-grid",
  "puzzleId": "city-grid-v1-0119",
  "date": "2026-01-01",
  "seed": "city-grid-v1-0119",
  "display": {
    "title": "City Grid",
    "initialPrompt": "Identify the city from the unlabeled street grid."
  },
  "extension": {
    "answer": {
      "entityId": "city:geonames:2147714",
      "canonicalName": "Sydney",
      "aliases": [
        "Sydney",
        "Sydney, AU",
        "Sydney Australia",
        "Sydney New South Wales"
      ],
      "countryCode": "AU",
      "country": "Australia",
      "admin1": "New South Wales",
      "lat": -33.86785,
      "lon": 151.20732,
      "population": 5557233
    },
    "candidateSetId": "world-famous-cities-geonames-v1",
    "source": {
      "kind": "osm-derived",
      "sourceManifest": "content/source/osm-source-manifest.json",
      "sourceExtractId": "overpass-real-osm-world-famous-geonames-v1",
      "bbox": {
        "left": 151.158495,
        "bottom": -33.908391,
        "right": 151.256145,
        "top": -33.827309
      },
      "geometryVersion": "city-grid-geometry.v1"
    },
    "assetStages": [
      {
        "stage": 0,
        "assetPath": "content/assets/v1/city-grid/sydney-au-2147714/stage-0.svg",
        "reveals": [
          "roads-tight"
        ]
      },
      {
        "stage": 1,
        "assetPath": "content/assets/v1/city-grid/sydney-au-2147714/stage-1.svg",
        "reveals": [
          "roads-wide",
          "arterials"
        ]
      },
      {
        "stage": 2,
        "assetPath": "content/assets/v1/city-grid/sydney-au-2147714/stage-2.svg",
        "reveals": [
          "water",
          "coastline"
        ]
      },
      {
        "stage": 3,
        "assetPath": "content/assets/v1/city-grid/sydney-au-2147714/stage-3.svg",
        "reveals": [
          "parks",
          "rail"
        ]
      },
      {
        "stage": 4,
        "assetPath": "content/assets/v1/city-grid/sydney-au-2147714/stage-4.svg",
        "reveals": [
          "neighborhood-streets",
          "anonymous-landmarks"
        ]
      },
      {
        "stage": 5,
        "assetPath": "content/assets/v1/city-grid/sydney-au-2147714/stage-5.svg",
        "reveals": [
          "full-street-network",
          "full-map-geometry"
        ]
      }
    ],
    "geometryMetrics": {
      "roadLineCount": 380,
      "roadTotalLengthMeters": 207537,
      "intersectionCount": 188,
      "waterGeometryCount": 70,
      "parkGeometryCount": 80,
      "railLineCount": 70
    },
    "clues": {
      "continent": "Oceania",
      "country": "Australia",
      "populationBand": "5m-10m",
      "coastal": false,
      "hasMajorRapidTransit": true
    }
  }
}
