{
  "schemaVersion": "daily-game-puzzle.v1",
  "gameId": "city-grid",
  "puzzleId": "city-grid-v1-0524",
  "date": "2026-01-01",
  "seed": "city-grid-v1-0524",
  "display": {
    "title": "City Grid",
    "initialPrompt": "Identify the city from the unlabeled street grid."
  },
  "extension": {
    "answer": {
      "entityId": "city:geonames:993800",
      "canonicalName": "Johannesburg",
      "aliases": [
        "Johannesburg",
        "Johannesburg, ZA",
        "Johannesburg South Africa",
        "Johannesburg Gauteng"
      ],
      "countryCode": "ZA",
      "country": "South Africa",
      "admin1": "Gauteng",
      "lat": -26.20227,
      "lon": 28.04363,
      "population": 9418183
    },
    "candidateSetId": "world-top-100-cities-geonames-v1",
    "source": {
      "kind": "osm-derived",
      "sourceManifest": "content/source/osm-source-manifest.json",
      "sourceExtractId": "overpass-real-osm-world-top-100-geonames-v1",
      "bbox": {
        "left": 28.000957,
        "bottom": -26.240558,
        "right": 28.086303,
        "top": -26.163982
      },
      "geometryVersion": "city-grid-geometry.v1"
    },
    "assetStages": [
      {
        "stage": 0,
        "assetPath": "content/assets/v1/city-grid/johannesburg-za-993800/stage-0.svg",
        "reveals": [
          "roads-tight"
        ]
      },
      {
        "stage": 1,
        "assetPath": "content/assets/v1/city-grid/johannesburg-za-993800/stage-1.svg",
        "reveals": [
          "roads-wide"
        ]
      },
      {
        "stage": 2,
        "assetPath": "content/assets/v1/city-grid/johannesburg-za-993800/stage-2.svg",
        "reveals": [
          "water",
          "coastline"
        ]
      },
      {
        "stage": 3,
        "assetPath": "content/assets/v1/city-grid/johannesburg-za-993800/stage-3.svg",
        "reveals": [
          "parks",
          "rail"
        ]
      },
      {
        "stage": 4,
        "assetPath": "content/assets/v1/city-grid/johannesburg-za-993800/stage-4.svg",
        "reveals": [
          "anonymous-landmarks"
        ]
      },
      {
        "stage": 5,
        "assetPath": "content/assets/v1/city-grid/johannesburg-za-993800/stage-5.svg",
        "reveals": [
          "full-map-geometry"
        ]
      }
    ],
    "geometryMetrics": {
      "roadLineCount": 380,
      "roadTotalLengthMeters": 381442,
      "intersectionCount": 204,
      "waterGeometryCount": 44,
      "parkGeometryCount": 80,
      "railLineCount": 70
    },
    "clues": {
      "continent": "Africa",
      "country": "South Africa",
      "populationBand": "5m-10m",
      "coastal": false,
      "hasMajorRapidTransit": true
    }
  }
}
