{
  "schemaVersion": "daily-game-puzzle.v1",
  "gameId": "flag-fade",
  "puzzleId": "flag-fade-v1-0161",
  "date": "2026-01-01",
  "seed": "flag-fade-v1-0161",
  "display": {
    "title": "Flag Fade",
    "initialPrompt": "Guess the country from the progressively clearer flag."
  },
  "extension": {
    "answer": {
      "entityId": "country:italy",
      "canonicalName": "Italy",
      "aliases": [
        "Italia",
        "IT",
        "ITA",
        "Italian flag"
      ],
      "iso2": "IT",
      "iso3": "ITA",
      "continent": "Europe",
      "clues": {
        "dominantColors": [
          "green",
          "white",
          "red"
        ],
        "hasEmblem": false,
        "stripeOrientation": "vertical",
        "aspectRatio": "2:3",
        "continent": "Europe",
        "designFeatures": [
          "vertical tricolor"
        ],
        "similarityGroups": [
          "tricolor"
        ]
      }
    },
    "candidateSetId": "countries-v1",
    "assetStages": [
      {
        "stage": 0,
        "assetPath": "content/assets/v1/flag-fade/it/stage-0.svg",
        "reveals": [
          "palette"
        ]
      },
      {
        "stage": 1,
        "assetPath": "content/assets/v1/flag-fade/it/stage-1.svg",
        "reveals": [
          "pixelated"
        ]
      },
      {
        "stage": 2,
        "assetPath": "content/assets/v1/flag-fade/it/stage-2.svg",
        "reveals": [
          "blurred"
        ]
      },
      {
        "stage": 3,
        "assetPath": "content/assets/v1/flag-fade/it/stage-3.svg",
        "reveals": [
          "major-shapes",
          "emblem"
        ]
      },
      {
        "stage": 4,
        "assetPath": "content/assets/v1/flag-fade/it/stage-4.svg",
        "reveals": [
          "near-full"
        ]
      },
      {
        "stage": 5,
        "assetPath": "content/assets/v1/flag-fade/it/stage-5.svg",
        "reveals": [
          "full-flag"
        ]
      }
    ],
    "clues": {
      "dominantColors": [
        "green",
        "white",
        "red"
      ],
      "hasEmblem": false,
      "stripeOrientation": "vertical",
      "aspectRatio": "2:3",
      "continent": "Europe",
      "designFeatures": [
        "vertical tricolor"
      ],
      "similarityGroups": [
        "tricolor"
      ]
    },
    "similarFlags": [
      {
        "entityId": "country:france",
        "similarTo": [
          "country:italy"
        ],
        "reason": "shared flag design family"
      },
      {
        "entityId": "country:germany",
        "similarTo": [
          "country:italy"
        ],
        "reason": "shared flag design family"
      },
      {
        "entityId": "country:mexico",
        "similarTo": [
          "country:italy"
        ],
        "reason": "shared flag design family"
      },
      {
        "entityId": "country:nigeria",
        "similarTo": [
          "country:italy"
        ],
        "reason": "shared flag design family"
      }
    ]
  }
}
