{
  "schemaVersion": "daily-game-puzzle.v1",
  "gameId": "city-grid",
  "puzzleId": "city-grid-v1-0379",
  "date": "2026-01-01",
  "seed": "city-grid-v1-0379",
  "display": {
    "title": "City Grid",
    "initialPrompt": "Identify the city from the unlabeled street grid."
  },
  "extension": {
    "answer": {
      "entityId": "city:us:ca:los-angeles",
      "canonicalName": "Los Angeles",
      "aliases": [
        "LA",
        "Los Angeles, CA",
        "Los Angeles California",
        "L.A."
      ],
      "countryCode": "US",
      "country": "United States",
      "admin1": "California",
      "lat": 34.0522,
      "lon": -118.2437,
      "population": 3898747
    },
    "candidateSetId": "real-osm-city-sample-v1",
    "source": {
      "kind": "osm-derived",
      "sourceManifest": "content/source/osm-source-manifest.json",
      "sourceExtractId": "overpass-real-osm-city-sample-v1",
      "bbox": {
        "left": -118.3,
        "bottom": 34.01,
        "right": -118.2,
        "top": 34.09
      },
      "geometryVersion": "city-grid-geometry.v1"
    },
    "assetStages": [
      {
        "stage": 0,
        "assetPath": "content/assets/v1/city-grid/los-angeles/stage-0.svg",
        "reveals": [
          "roads-tight"
        ]
      },
      {
        "stage": 1,
        "assetPath": "content/assets/v1/city-grid/los-angeles/stage-1.svg",
        "reveals": [
          "roads-wide"
        ]
      },
      {
        "stage": 2,
        "assetPath": "content/assets/v1/city-grid/los-angeles/stage-2.svg",
        "reveals": [
          "water",
          "coastline"
        ]
      },
      {
        "stage": 3,
        "assetPath": "content/assets/v1/city-grid/los-angeles/stage-3.svg",
        "reveals": [
          "parks",
          "rail"
        ]
      },
      {
        "stage": 4,
        "assetPath": "content/assets/v1/city-grid/los-angeles/stage-4.svg",
        "reveals": [
          "anonymous-landmarks"
        ]
      },
      {
        "stage": 5,
        "assetPath": "content/assets/v1/city-grid/los-angeles/stage-5.svg",
        "reveals": [
          "full-map-geometry"
        ]
      }
    ],
    "geometryMetrics": {
      "roadLineCount": 780,
      "roadTotalLengthMeters": 498601,
      "intersectionCount": 397,
      "waterGeometryCount": 18,
      "parkGeometryCount": 140,
      "railLineCount": 120
    },
    "clues": {
      "continent": "North America",
      "country": "United States",
      "populationBand": "1m+",
      "coastal": true,
      "hasMajorRapidTransit": true
    }
  }
}
