{
  "schemaVersion": "daily-game-puzzle.v1",
  "gameId": "city-grid",
  "puzzleId": "city-grid-v1-0412",
  "date": "2026-01-01",
  "seed": "city-grid-v1-0412",
  "display": {
    "title": "City Grid",
    "initialPrompt": "Identify the city from the unlabeled street grid."
  },
  "extension": {
    "answer": {
      "entityId": "city:geonames:3530597",
      "canonicalName": "Mexico City",
      "aliases": [
        "Mexico City",
        "Mexico City, MX",
        "Mexico City Mexico",
        "Mexico City Mexico City"
      ],
      "countryCode": "MX",
      "country": "Mexico",
      "admin1": "Mexico City",
      "lat": 19.42847,
      "lon": -99.12766,
      "population": 12294193
    },
    "candidateSetId": "world-top-100-cities-geonames-v1",
    "source": {
      "kind": "osm-derived",
      "sourceManifest": "content/source/osm-source-manifest.json",
      "sourceExtractId": "overpass-real-osm-world-top-100-geonames-v1",
      "bbox": {
        "left": -99.170648,
        "bottom": 19.387929,
        "right": -99.084672,
        "top": 19.469011
      },
      "geometryVersion": "city-grid-geometry.v1"
    },
    "assetStages": [
      {
        "stage": 0,
        "assetPath": "content/assets/v1/city-grid/mexico-city-mx-3530597/stage-0.svg",
        "reveals": [
          "roads-tight"
        ]
      },
      {
        "stage": 1,
        "assetPath": "content/assets/v1/city-grid/mexico-city-mx-3530597/stage-1.svg",
        "reveals": [
          "roads-wide"
        ]
      },
      {
        "stage": 2,
        "assetPath": "content/assets/v1/city-grid/mexico-city-mx-3530597/stage-2.svg",
        "reveals": [
          "water",
          "coastline"
        ]
      },
      {
        "stage": 3,
        "assetPath": "content/assets/v1/city-grid/mexico-city-mx-3530597/stage-3.svg",
        "reveals": [
          "parks",
          "rail"
        ]
      },
      {
        "stage": 4,
        "assetPath": "content/assets/v1/city-grid/mexico-city-mx-3530597/stage-4.svg",
        "reveals": [
          "anonymous-landmarks"
        ]
      },
      {
        "stage": 5,
        "assetPath": "content/assets/v1/city-grid/mexico-city-mx-3530597/stage-5.svg",
        "reveals": [
          "full-map-geometry"
        ]
      }
    ],
    "geometryMetrics": {
      "roadLineCount": 380,
      "roadTotalLengthMeters": 310996,
      "intersectionCount": 187,
      "waterGeometryCount": 70,
      "parkGeometryCount": 80,
      "railLineCount": 70
    },
    "clues": {
      "continent": "North America",
      "country": "Mexico",
      "populationBand": "10m+",
      "coastal": false,
      "hasMajorRapidTransit": true
    }
  }
}
